{
  "schema": "urn:aihq:core:execution-policy:1.4.0",
  "mode": "vibe",
  "selections": [
    {
      "id": "guidance",
      "managementId": "team-guidance",
      "scope": "project",
      "configuration": {
        "text": "Read the project's contribution guide.\n"
      },
      "requires": [],
      "recipe": {
        "inline": {
          "schema": "urn:aihq:core:recipe:1.3.0",
          "id": "guidance-file",
          "description": "Deliver project guidance",
          "inputs": {
            "text": {
              "type": "string",
              "required": true,
              "maxLength": 65536
            }
          },
          "materials": [],
          "targets": [
            "project"
          ],
          "prerequisites": [],
          "operations": [
            {
              "id": "write",
              "purpose": "Write shared project guidance",
              "kind": "file.write",
              "scope": "project",
              "target": {
                "root": "project",
                "segments": [
                  {
                    "literal": "TEAM.md"
                  }
                ]
              },
              "content": {
                "input": "text"
              },
              "requires": [],
              "checks": []
            }
          ],
          "checks": []
        }
      },
      "item": {
        "framework": "example-framework",
        "itemId": "team-guidance",
        "contentSha256": "1111111111111111111111111111111111111111111111111111111111111111",
        "behaviourSha256": "2222222222222222222222222222222222222222222222222222222222222222"
      },
      "tool": "claude",
      "name": "Team guidance",
      "kind": "document",
      "origins": [
        {
          "reasonIncluded": "chosen"
        },
        {
          "reasonIncluded": "in-set",
          "set": {
            "framework": "example-framework",
            "setId": "starter",
            "setSha256": "3333333333333333333333333333333333333333333333333333333333333333"
          },
          "options": {
            "languages": [
              "typescript"
            ]
          }
        },
        {
          "reasonIncluded": "required-by",
          "requiredBy": {
            "framework": "example-framework",
            "itemId": "onboarding"
          }
        }
      ]
    }
  ],
  "excludedItems": [
    {
      "framework": "example-framework",
      "itemId": "session-hooks"
    }
  ]
}
